{
  "municipalityCode": "27223",
  "municipalityName": "門真市",
  "targetAddressPreset": "大倉町1-20",
  "defaultAreaId": "A",
  "fiscalYear": 2026,
  "version": "2026.04.01-af.2",
  "sourceUpdatedAt": "2026-03-30",
  "generatedAt": "2026-05-25T11:45:00+09:00",
  "sourcePages": [
    {
      "title": "地区別ごみカレンダー",
      "url": "https://www.city.kadoma.osaka.jp/kurashi/gomi/9/35805.html",
      "updatedAt": "2026-03-30"
    },
    {
      "title": "ごみの出し方・分け方",
      "url": "https://www.city.kadoma.osaka.jp/kurashi/gomi/9/6/4394.html",
      "updatedAt": "2026-03-30"
    },
    {
      "title": "粗大ごみの電話申込み",
      "url": "https://www.city.kadoma.osaka.jp/kurashi/gomi/9/5/22406.html",
      "updatedAt": "2026-03-30"
    },
    {
      "title": "粗大ごみのインターネット申込み",
      "url": "https://www.city.kadoma.osaka.jp/kurashi/gomi/9/5/22408.html",
      "updatedAt": "2026-03-30"
    }
  ],
  "areas": [
    {
      "id": "A",
      "name": "A地区",
      "towns": [
        {
          "townName": "石原町",
          "areaId": "A",
          "blockRange": null
        },
        {
          "townName": "泉町",
          "areaId": "A",
          "blockRange": null
        },
        {
          "townName": "大倉町",
          "areaId": "A",
          "blockRange": null
        },
        {
          "townName": "垣内町",
          "areaId": "A",
          "blockRange": null
        },
        {
          "townName": "幸福町",
          "areaId": "A",
          "blockRange": null
        },
        {
          "townName": "新橋町",
          "areaId": "A",
          "blockRange": null
        },
        {
          "townName": "末広町",
          "areaId": "A",
          "blockRange": null
        },
        {
          "townName": "月出町",
          "areaId": "A",
          "blockRange": null
        },
        {
          "townName": "中町",
          "areaId": "A",
          "blockRange": null
        },
        {
          "townName": "浜町",
          "areaId": "A",
          "blockRange": null
        },
        {
          "townName": "速見町",
          "areaId": "A",
          "blockRange": null
        },
        {
          "townName": "古川町",
          "areaId": "A",
          "blockRange": null
        },
        {
          "townName": "松葉町",
          "areaId": "A",
          "blockRange": null
        },
        {
          "townName": "御堂町",
          "areaId": "A",
          "blockRange": null
        },
        {
          "townName": "向島町",
          "areaId": "A",
          "blockRange": null
        },
        {
          "townName": "柳町",
          "areaId": "A",
          "blockRange": null
        }
      ],
      "schedules": [
        {
          "id": "a-burnable",
          "categoryId": "burnable",
          "recurrenceType": "weekly",
          "weekdays": [
            2,
            5
          ],
          "weekOfMonth": null,
          "specificDates": null,
          "validFrom": "2026-04-01",
          "validTo": "2027-03-31"
        },
        {
          "id": "a-plastic-container",
          "categoryId": "plastic_container",
          "recurrenceType": "weekly",
          "weekdays": [
            1
          ],
          "weekOfMonth": null,
          "specificDates": null,
          "validFrom": "2026-04-01",
          "validTo": "2027-03-31"
        },
        {
          "id": "a-bottles-cans",
          "categoryId": "bottles_cans",
          "recurrenceType": "weekly",
          "weekdays": [
            4
          ],
          "weekOfMonth": null,
          "specificDates": null,
          "validFrom": "2026-04-01",
          "validTo": "2027-03-31"
        },
        {
          "id": "a-paper-cloth",
          "categoryId": "paper_cloth",
          "recurrenceType": "monthlyNthWeekday",
          "weekdays": [
            3
          ],
          "weekOfMonth": [
            4
          ],
          "specificDates": null,
          "validFrom": "2026-04-01",
          "validTo": "2027-03-31"
        },
        {
          "id": "a-small-items",
          "categoryId": "small_items",
          "recurrenceType": "monthlyNthWeekday",
          "weekdays": [
            3
          ],
          "weekOfMonth": [
            2
          ],
          "specificDates": null,
          "validFrom": "2026-04-01",
          "validTo": "2027-03-31"
        },
        {
          "id": "a-pet-bottle",
          "categoryId": "pet_bottle",
          "recurrenceType": "monthlyNthWeekday",
          "weekdays": [
            3
          ],
          "weekOfMonth": [
            1,
            3
          ],
          "specificDates": null,
          "validFrom": "2026-04-01",
          "validTo": "2027-03-31"
        },
        {
          "id": "a-bulky",
          "categoryId": "bulky",
          "recurrenceType": "weekly",
          "weekdays": [
            4
          ],
          "weekOfMonth": null,
          "specificDates": null,
          "validFrom": "2026-04-01",
          "validTo": "2027-03-31"
        }
      ],
      "exceptions": [
        {
          "date": "2026-12-28",
          "areaId": "A",
          "categoryId": "plastic_container",
          "action": "note",
          "reason": "年末年始は公式ページ・広報で最新の変更有無を確認してください。"
        },
        {
          "date": "2027-01-04",
          "areaId": "A",
          "categoryId": "plastic_container",
          "action": "note",
          "reason": "年末年始は公式ページ・広報で最新の変更有無を確認してください。"
        }
      ]
    },
    {
      "id": "B",
      "name": "B地区",
      "towns": [
        {
          "townName": "朝日町",
          "areaId": "B",
          "blockRange": null
        },
        {
          "townName": "大池町",
          "areaId": "B",
          "blockRange": null
        },
        {
          "townName": "大橋町",
          "areaId": "B",
          "blockRange": null
        },
        {
          "townName": "上島町",
          "areaId": "B",
          "blockRange": null
        },
        {
          "townName": "上野口町",
          "areaId": "B",
          "blockRange": null
        },
        {
          "townName": "北巣本町",
          "areaId": "B",
          "blockRange": "1番～34番"
        },
        {
          "townName": "寿町",
          "areaId": "B",
          "blockRange": null
        },
        {
          "townName": "下島町",
          "areaId": "B",
          "blockRange": null
        },
        {
          "townName": "常称寺町",
          "areaId": "B",
          "blockRange": null
        },
        {
          "townName": "城垣町",
          "areaId": "B",
          "blockRange": null
        },
        {
          "townName": "常盤町",
          "areaId": "B",
          "blockRange": null
        },
        {
          "townName": "野里町",
          "areaId": "B",
          "blockRange": null
        },
        {
          "townName": "宮野町",
          "areaId": "B",
          "blockRange": null
        },
        {
          "townName": "宮前町",
          "areaId": "B",
          "blockRange": null
        }
      ],
      "schedules": [
        {
          "id": "b-burnable",
          "categoryId": "burnable",
          "recurrenceType": "weekly",
          "weekdays": [
            2,
            5
          ],
          "weekOfMonth": null,
          "specificDates": null,
          "validFrom": "2026-04-01",
          "validTo": "2027-03-31"
        },
        {
          "id": "b-plastic-container",
          "categoryId": "plastic_container",
          "recurrenceType": "weekly",
          "weekdays": [
            4
          ],
          "weekOfMonth": null,
          "specificDates": null,
          "validFrom": "2026-04-01",
          "validTo": "2027-03-31"
        },
        {
          "id": "b-bottles-cans",
          "categoryId": "bottles_cans",
          "recurrenceType": "weekly",
          "weekdays": [
            1
          ],
          "weekOfMonth": null,
          "specificDates": null,
          "validFrom": "2026-04-01",
          "validTo": "2027-03-31"
        },
        {
          "id": "b-paper-cloth",
          "categoryId": "paper_cloth",
          "recurrenceType": "monthlyNthWeekday",
          "weekdays": [
            3
          ],
          "weekOfMonth": [
            1
          ],
          "specificDates": null,
          "validFrom": "2026-04-01",
          "validTo": "2027-03-31"
        },
        {
          "id": "b-small-items",
          "categoryId": "small_items",
          "recurrenceType": "monthlyNthWeekday",
          "weekdays": [
            3
          ],
          "weekOfMonth": [
            3
          ],
          "specificDates": null,
          "validFrom": "2026-04-01",
          "validTo": "2027-03-31"
        },
        {
          "id": "b-pet-bottle",
          "categoryId": "pet_bottle",
          "recurrenceType": "monthlyNthWeekday",
          "weekdays": [
            3
          ],
          "weekOfMonth": [
            2,
            4
          ],
          "specificDates": null,
          "validFrom": "2026-04-01",
          "validTo": "2027-03-31"
        },
        {
          "id": "b-bulky",
          "categoryId": "bulky",
          "recurrenceType": "weekly",
          "weekdays": [
            1
          ],
          "weekOfMonth": null,
          "specificDates": null,
          "validFrom": "2026-04-01",
          "validTo": "2027-03-31"
        }
      ],
      "exceptions": []
    },
    {
      "id": "C",
      "name": "C地区",
      "towns": [
        {
          "townName": "打越",
          "areaId": "C",
          "blockRange": null
        },
        {
          "townName": "江端町",
          "areaId": "C",
          "blockRange": null
        },
        {
          "townName": "岸和田",
          "areaId": "C",
          "blockRange": "1丁目～4丁目"
        },
        {
          "townName": "北岸和田",
          "areaId": "C",
          "blockRange": "1丁目～3丁目"
        },
        {
          "townName": "北島",
          "areaId": "C",
          "blockRange": null
        },
        {